PROGRAM Investment Name,PROGRAM Agency,PROGRAM Subagency
Centers for Ocean Sciences Education Excellence ~,National Science Foundation,Directorate for Geosciences (GEO)
Broadening Participation in Computing (BPC),National Science Foundation,Directorate for Computer & Information Science & Engineering (CISE)
CISE Pathways to Revitalized Undergraduate Computing Education (CPATH),National Science Foundation,Directorate for Computer & Information Science & Engineering (CISE)
Opportunities for Enhancing Diversity in the Geosciences,National Science Foundation,Directorate for Geosciences (GEO)
Geoscience Education,National Science Foundation,Directorate for Geosciences (GEO)
Geoscience Teacher Training (GEO-Teach),National Science Foundation,Directorate for Geosciences (GEO)
